{
  "id": "utility.skip-link",
  "title": "Skip link",
  "source": {
    "id": "src.skip",
    "file": "src/components/Skip.jsx",
    "tag": "a",
    "lines": "4",
    "citation": "src/components/Skip.jsx:4",
    "marker": "<a className={\"skip\"}"
  },
  "semantic": {
    "id": "utility.skip-link",
    "category": "UTILITY"
  },
  "region": "pre-main",
  "themes": [
    "inherit"
  ],
  "variants": [
    "default"
  ],
  "retrievalEligible": false,
  "content": {
    "label": {
      "type": "text",
      "maxWords": 4
    }
  },
  "motion": {
    "allowedPatterns": [
      "none"
    ],
    "reducedMotionFallback": {
      "none": "none"
    }
  },
  "retrievalIneligibleReason": "Keyboard skip link: off-screen until focused, carries no page content and must never be retrieved as a content section.",
  "generatedAssetRoles": [],
  "measured": {
    "position": "fixed",
    "box": "left 16px, top -60px; top 16px on :focus",
    "evidence": {
      "cite": "public/assets/css/site.css:71-72",
      "expect": ".skip{position:fixed"
    }
  },
  "contentRequired": [
    "label"
  ]
}
